{
  "schema_version": "adds.source-receipt.v1",
  "receipt_id": "example-burden-receipt",
  "source": {
    "source_id": "example-burden-source",
    "source_version": "snapshot-2024-06-15",
    "locator": "https://example.invalid/public-source/burden",
    "content_hash": "bcac27b56302a8decce9e5576209bbcbced2bd38c418e38507b23340b201a2a2"
  },
  "retrieved_at": "2024-06-15T12:00:00Z",
  "byte_size": 128,
  "media_type": "application/json",
  "transport": {
    "method": "local_file"
  }
}
